{
  "schema_version": "0.1.0",
  "stage": "8h",
  "layer": "Design C: synthetic control with in-space and in-time placebos - an effect estimate only where its placebos support one",
  "vintage": "2026-10-18",
  "generated_at": "2026-10-28T06:48:23+0100",
  "generator": {
    "script": "analysis/R/11_design_c.R",
    "git_sha": "613ccf5"
  },
  "spec": {
    "path": "analysis/specs/design_c.yml",
    "md5": "1e22f952b9f22dd753f70bc0b0cd82be",
    "stamp": "declared 2026-10-28, before any weight was fitted",
    "estimator": "simplex-constrained least squares on the pre-treatment outcome path (quadprog), fixed objective",
    "verdict_rule": "A window is `identified` only if **all three** hold: (1) its pre-fit ratio is at or below 0.10, the gate's own threshold, carried rather than re-decided; (2) the in-space rank p is at or below 0.05, i.e. the treated unit's post/pre RMSPE ratio is the largest among itself and the placebos; and (3) every in-time placebo that could be run returns a mean gap smaller in absolute value than **half** the estimated gap. Otherwise the window is `estimated_not_identified` and each failed check is named. A window the gate refused is `refused` with the gate's reason and no number. Report the gap and its placebos either way. Declared 2026-10-28, before any weight was fitted.",
    "refusals": ["no standard error, confidence interval or p-value other than the rank p — a synthetic control has no sampling distribution", "no significance claim from the pre-fit ratio alone; the ratio is a fit diagnostic, and with 99 donors it is interpolation", "no per-president wording: windows are keyed by tenure id, and the artifact prints no surname"],
    "not_claimed": ["This is not the effect of a president. It is the gap between Nigeria's path and a weighted combination of other countries' paths after a transition.", "The counterfactual is not observed. A low pre-fit ratio shows the donors can reproduce the pre-period, not that they would have reproduced the post-period without the transition.", "The donor pool is countries, not Nigerian states: it cannot hold constant anything Nigeria-specific — the oil cycle, the naira, the security environment.", "The windows overlap in their pre-periods and are not additive: a later window's counterfactual already contains the earlier tenures.", "The pre-fit gate does not discriminate on this pool: 99 donors and 8 to 16 pre-years make the fit underdetermined, so the placebos carry the verdict."]
  },
  "input": {
    "database": "data/analytics.duckdb",
    "donor_table": "main_analytics.fact_donor_panel",
    "native_table": "main_analytics.fact_observation_native",
    "outcome": "u5mr",
    "treated_iso3": "NGA",
    "donor_pool": {
      "n": 99,
      "artifact": "registry/donors/2026-10-18/panel.json"
    },
    "treated_series": "fact_observation_native, native_frequency = 'annual'",
    "window_years": "1999-2024",
    "pre_fit_threshold": 0.1
  },
  "counts": {
    "windows": 5,
    "estimated": 4,
    "refused": 1,
    "identified": 0,
    "not_identified": 4,
    "donors": 99,
    "placebos_in_space": 396,
    "placebos_in_time": 7,
    "placebos_passing_pre_fit": 304,
    "loo_fits": 396
  },
  "windows": [
    {
      "id": "obasanjo",
      "status": "refused",
      "refused": {
        "reason": "gate_window_not_runnable",
        "detail": "0 pre and 8 post years against the declared minima of 8 and 2 (the year belongs to the administration in office on 1 July)"
      },
      "pre_years": 0,
      "post_years": 8
    },
    {
      "id": "yaradua",
      "status": "estimated_not_identified",
      "first_year": 2007,
      "last_year": 2009,
      "pre_years": 8,
      "post_years": 3,
      "n_donors_used": 99,
      "n_donors_with_weight": 8,
      "path": [
        {
          "year": 2007,
          "treated": 136.5,
          "synthetic": 135.8518559,
          "gap": 0.6481440559
        },
        {
          "year": 2008,
          "treated": 132.5,
          "synthetic": 130.7860316,
          "gap": 1.713968356
        },
        {
          "year": 2009,
          "treated": 129.2,
          "synthetic": 125.2394404,
          "gap": 3.960559584
        }
      ],
      "pre_rmse": 0.02590140527,
      "pre_sd": 15.18598978,
      "pre_ratio": 0.001705611925,
      "post_rmse": 2.519511227,
      "post_pre_ratio": 97.27314794,
      "mean_gap": 2.107557332,
      "weights": [
        {
          "donor": "COD",
          "weight": 0.008076299125
        },
        {
          "donor": "GIN",
          "weight": 0.1228520139
        },
        {
          "donor": "LKA",
          "weight": 0.002697932624
        },
        {
          "donor": "LSO",
          "weight": 0.06415415827
        },
        {
          "donor": "NER",
          "weight": 0.06951221913
        },
        {
          "donor": "RWA",
          "weight": 0.280796842
        },
        {
          "donor": "SLE",
          "weight": 0.05252102093
        },
        {
          "donor": "SOM",
          "weight": 0.3993895128
        }
      ],
      "n_weights_published": 8,
      "in_space": {
        "n_placebos": 99,
        "p_value": 0.5,
        "n_at_least_as_extreme": 49,
        "n_placebos_passing_pre_fit": 82,
        "distribution": [
          {
            "donor": "AGO",
            "pre_ratio": 0.0385659,
            "post_pre_ratio": 9.23789,
            "mean_gap": -8.77945
          },
          {
            "donor": "ARE",
            "pre_ratio": 0.173444,
            "post_pre_ratio": 7.2924,
            "mean_gap": -0.560019
          },
          {
            "donor": "AZE",
            "pre_ratio": 8.59491e-06,
            "post_pre_ratio": 3974.52,
            "mean_gap": -0.308819
          },
          {
            "donor": "BDI",
            "pre_ratio": 0.00167904,
            "post_pre_ratio": 12.4097,
            "mean_gap": -0.244223
          },
          {
            "donor": "BEN",
            "pre_ratio": 6.90025e-05,
            "post_pre_ratio": 3534.39,
            "mean_gap": 1.45472
          },
          {
            "donor": "BFA",
            "pre_ratio": 0.000466921,
            "post_pre_ratio": 853.244,
            "mean_gap": -2.41526
          },
          {
            "donor": "BGD",
            "pre_ratio": 4.23935e-05,
            "post_pre_ratio": 1122.86,
            "mean_gap": -0.495738
          },
          {
            "donor": "BOL",
            "pre_ratio": 3.6533e-05,
            "post_pre_ratio": 858.162,
            "mean_gap": -0.220872
          },
          {
            "donor": "BRA",
            "pre_ratio": 0.000688106,
            "post_pre_ratio": 24.3476,
            "mean_gap": -0.080362
          },
          {
            "donor": "BRN",
            "pre_ratio": 0.445703,
            "post_pre_ratio": 4.0864,
            "mean_gap": 0.706661
          },
          {
            "donor": "BWA",
            "pre_ratio": 0.0331084,
            "post_pre_ratio": 15.3098,
            "mean_gap": 2.36552
          },
          {
            "donor": "CAF",
            "pre_ratio": 0.00244109,
            "post_pre_ratio": 9801.54,
            "mean_gap": 118.992
          },
          {
            "donor": "CIV",
            "pre_ratio": 7.80258e-06,
            "post_pre_ratio": 116616,
            "mean_gap": -5.29057
          },
          {
            "donor": "CMR",
            "pre_ratio": 0.000149557,
            "post_pre_ratio": 27147.1,
            "mean_gap": -18.462
          },
          {
            "donor": "COD",
            "pre_ratio": 0.258328,
            "post_pre_ratio": 0.971187,
            "mean_gap": 5.51643
          },
          {
            "donor": "COG",
            "pre_ratio": 0.0430313,
            "post_pre_ratio": 2.38226,
            "mean_gap": -1.19368
          },
          {
            "donor": "COL",
            "pre_ratio": 0.00524039,
            "post_pre_ratio": 33.0912,
            "mean_gap": 0.265733
          },
          {
            "donor": "CPV",
            "pre_ratio": 0.161164,
            "post_pre_ratio": 2.51182,
            "mean_gap": 1.77331
          },
          {
            "donor": "DJI",
            "pre_ratio": 7.47095e-05,
            "post_pre_ratio": 2200.97,
            "mean_gap": 0.423386
          },
          {
            "donor": "DOM",
            "pre_ratio": 0.000479598,
            "post_pre_ratio": 1545.33,
            "mean_gap": 1.10283
          },
          {
            "donor": "DZA",
            "pre_ratio": 1.71243e-05,
            "post_pre_ratio": 4092.12,
            "mean_gap": 0.175623
          },
          {
            "donor": "ECU",
            "pre_ratio": 0.000557856,
            "post_pre_ratio": 369.669,
            "mean_gap": -0.584799
          },
          {
            "donor": "EGY",
            "pre_ratio": 9.23644e-05,
            "post_pre_ratio": 471.177,
            "mean_gap": -0.196913
          },
          {
            "donor": "ERI",
            "pre_ratio": 0.000384445,
            "post_pre_ratio": 46.8734,
            "mean_gap": 0.185879
          },
          {
            "donor": "ETH",
            "pre_ratio": 2.62643e-05,
            "post_pre_ratio": 7094.96,
            "mean_gap": -1.64402
          },
          {
            "donor": "GAB",
            "pre_ratio": 0.00225403,
            "post_pre_ratio": 42.6635,
            "mean_gap": -0.0480293
          },
          {
            "donor": "GHA",
            "pre_ratio": 7.94812e-05,
            "post_pre_ratio": 1417.98,
            "mean_gap": -0.898307
          },
          {
            "donor": "GIN",
            "pre_ratio": 0.00677998,
            "post_pre_ratio": 25.5305,
            "mean_gap": 2.14378
          },
          {
            "donor": "GMB",
            "pre_ratio": 0.00012305,
            "post_pre_ratio": 477.89,
            "mean_gap": 0.48312
          },